Player,Você me denunciou????,Hater Boss,Hater_idle-Sheet_0,Lele_mov_frente,Hater Boss
NPC,"Se a gente pudesse conversar com mais calma, eu não teria feito isso",Lelê,Lele_mov_frente,Hater_idle-Sheet_0,Lele
Player,Você nunca vai mandar em mim !!!!,Hater Boss,Hater_idle-Sheet_0,Lele_mov_frente,Hater Boss
Player,"Devido a alta quantidade de denúncias em Turitter nos últimos dias, atualizamos as regras de convivência no reino.",Sistema,,Hater_Congeladov2,Sistema
Player,Levaremos a sério casos criminais na internet. Pedimos que leiam as atualizações das diretrizes e regras da comunidade e respeitem uns aos outros.,Sistema,,Hater_Congeladov2,Sistema
Player,Finalmente vai ter justiça por aqui.,Lelê,Lele_mov_frente,Hater_Congeladov2,Lele