Player,"Ei, mas a resposta tava errada",Lelê,Lele_mov_frente,PeaoVermelho_Mov_0
NPC,"KKKKKKKKKK que otária, eu vou lá saber, isso aí nem é legal kkkkk",Peão,Lele_mov_frente,PeaoVermelho_Mov_0
Player,Droga,Lelê,Lele_mov_frente,None
Player,LELEEE,Mia,Mia_Feliz,Lele_mov_frente
Player,"Ah, oi Mia, tudo bem?",Lelê,Lele_mov_frente,Mia_frente_Idle_sheet_0
NPC,"Oiiii, to bem sim",Mia,Lele_mov_frente,Mia_frente_Idle_sheet_0
NPC,"Vi que aquele cara te trollou, tem que ficar mais espera hihihi",Mia,Lele_mov_frente,Mia_frente_Idle_sheet_0
Player,"Verdade, achei que esse tipo de pessoa só existia lá no TicTeco",Lelê,Lele_mov_frente,Mia_frente_Idle_sheet_0
NPC,"N, eles estão por toda a parte",Mia,Lele_mov_frente,Mia_frente_Idle_sheet_0
Player,"Enfim Mia, você tá meio diferente né?",Lelê,Lele_mov_frente,Mia_frente_Idle_sheet_0
NPC,"Ah, é q eu queria fica mais parecida com vc",Mia,Lele_mov_frente,Mia_frente_Idle_sheet_0
Player,"Ficou muito bonita... Álias,",Lelê,Lele_mov_frente,Mia_frente_Idle_sheet_0
Player,Você sabe qual foi o evento mais importante do mundo LGBTQIAP+?,Lelê,Lele_mov_frente,Mia_frente_Idle_sheet_0
NPC,"Sei simm, foi a revolução de Stonewall. Ela foi um marco para os direitos da comunidade Lgbt+",Mia,Lele_mov_frente,Mia_frente_Idle_sheet_0
Player,"Ah não sabia disso, obrigada Mia, você é uma querida",Lelê,Lele_mov_frente,Mia_frente_Idle_sheet_0
Player,"Ela falou que eu sou querida, hihihihi",Mia,Mia_Feliz,Lele_mov_frente